{
  "schema_version": 1,
  "tool": {
    "name": "omarchy-m-test",
    "version": "0.1.2"
  },
  "consent_version": 3,
  "catalogue_version": 7,
  "machine": {
    "model": "Apple MacBook Pro (14-inch, M1 Pro, 2021)",
    "board": "j314s",
    "soc": "t6000",
    "chip": "M1 Pro",
    "arch": "aarch64",
    "kernel": "7.1.13-1-1-ARCH"
  },
  "system": {
    "stack": "mx-mac",
    "distro": "omarchy",
    "boot_loader": "grub",
    "encryption": "off",
    "packages": [
      {
        "name": "omarchy-dev",
        "version": "4.0.2.r6879.gaae2586-1"
      },
      {
        "name": "omarchy-settings-dev",
        "version": "4.0.2.r6879.gaae2586-1"
      },
      {
        "name": "linux-asahi",
        "version": "7.1.13.asahi1-1"
      },
      {
        "name": "m1n1",
        "version": "1.5.2-1"
      },
      {
        "name": "uboot-asahi",
        "version": "2025.10.asahi1-1"
      },
      {
        "name": "mesa",
        "version": "1:26.1.4-1"
      },
      {
        "name": "vulkan-asahi",
        "version": "1:26.1.4-1"
      },
      {
        "name": "asahi-audio",
        "version": "4.1-1"
      },
      {
        "name": "speakersafetyd",
        "version": "2.0.1-1"
      },
      {
        "name": "alsa-ucm-conf-asahi",
        "version": "10-1"
      }
    ]
  },
  "inventory": {
    "nodes": [
      {
        "compatible": "apple,agx-t6000",
        "status": "okay",
        "driver": "bound",
        "count": 1
      },
      {
        "compatible": "apple,cd321x",
        "status": "okay",
        "driver": "bound",
        "count": 4
      },
      {
        "compatible": "apple,display-subsystem",
        "status": "okay",
        "driver": "bound",
        "count": 1
      },
      {
        "compatible": "apple,firestorm-pmu",
        "status": "okay",
        "driver": "bound",
        "count": 1
      },
      {
        "compatible": "apple,icestorm-pmu",
        "status": "okay",
        "driver": "bound",
        "count": 1
      },
      {
        "compatible": "apple,j314-macaudio",
        "status": "okay",
        "driver": "bound",
        "count": 1
      },
      {
        "compatible": "apple,maverick-pmic",
        "status": "okay",
        "driver": "bound",
        "count": 1
      },
      {
        "compatible": "apple,panel-j314",
        "status": "okay",
        "driver": "none",
        "count": 1
      },
      {
        "compatible": "apple,s5l-uart",
        "status": "okay",
        "driver": "bound",
        "count": 1
      },
      {
        "compatible": "apple,sep",
        "status": "disabled",
        "driver": "none",
        "count": 1
      },
      {
        "compatible": "apple,smc-gpio",
        "status": "okay",
        "driver": "bound",
        "count": 1
      },
      {
        "compatible": "apple,smc-hwmon",
        "status": "okay",
        "driver": "bound",
        "count": 1
      },
      {
        "compatible": "apple,smc-reboot",
        "status": "okay",
        "driver": "bound",
        "count": 1
      },
      {
        "compatible": "apple,smc-rtc",
        "status": "okay",
        "driver": "bound",
        "count": 1
      },
      {
        "compatible": "apple,spi-hid-transport",
        "status": "okay",
        "driver": "bound",
        "count": 1
      },
      {
        "compatible": "apple,t6000-admac",
        "status": "okay",
        "driver": "bound",
        "count": 2
      },
      {
        "compatible": "apple,t6000-aic",
        "status": "okay",
        "driver": "none",
        "count": 1
      },
      {
        "compatible": "apple,t6000-aop",
        "status": "okay",
        "driver": "bound",
        "count": 1
      },
      {
        "compatible": "apple,t6000-aop-als",
        "status": "okay",
        "driver": "bound",
        "count": 1
      },
      {
        "compatible": "apple,t6000-aop-audio",
        "status": "okay",
        "driver": "bound",
        "count": 1
      },
      {
        "compatible": "apple,t6000-aop-las",
        "status": "okay",
        "driver": "bound",
        "count": 1
      },
      {
        "compatible": "apple,t6000-asc-mailbox",
        "status": "disabled",
        "driver": "none",
        "count": 1
      },
      {
        "compatible": "apple,t6000-asc-mailbox",
        "status": "okay",
        "driver": "bound",
        "count": 9
      },
      {
        "compatible": "apple,t6000-atcphy",
        "status": "okay",
        "driver": "bound",
        "count": 4
      },
      {
        "compatible": "apple,t6000-avd",
        "status": "okay",
        "driver": "bound",
        "count": 1
      },
      {
        "compatible": "apple,t6000-cluster-cpufreq",
        "status": "okay",
        "driver": "bound",
        "count": 3
      },
      {
        "compatible": "apple,t6000-dart",
        "status": "disabled",
        "driver": "none",
        "count": 7
      },
      {
        "compatible": "apple,t6000-dart",
        "status": "okay",
        "driver": "bound",
        "count": 19
      },
      {
        "compatible": "apple,t6000-dcp",
        "status": "okay",
        "driver": "bound",
        "count": 1
      },
      {
        "compatible": "apple,t6000-dcpext",
        "status": "disabled",
        "driver": "none",
        "count": 2
      },
      {
        "compatible": "apple,t6000-display-crossbar",
        "status": "disabled",
        "driver": "none",
        "count": 3
      },
      {
        "compatible": "apple,t6000-display-crossbar",
        "status": "okay",
        "driver": "bound",
        "count": 1
      },
      {
        "compatible": "apple,t6000-dpaudio",
        "status": "disabled",
        "driver": "none",
        "count": 2
      },
      {
        "compatible": "apple,t6000-dpaudio",
        "status": "okay",
        "driver": "unbound",
        "count": 1
      },
      {
        "compatible": "apple,t6000-dwc3",
        "status": "okay",
        "driver": "bound",
        "count": 3
      },
      {
        "compatible": "apple,t6000-fpwm",
        "status": "okay",
        "driver": "bound",
        "count": 1
      },
      {
        "compatible": "apple,t6000-i2c",
        "status": "disabled",
        "driver": "none",
        "count": 2
      },
      {
        "compatible": "apple,t6000-i2c",
        "status": "okay",
        "driver": "bound",
        "count": 4
      },
      {
        "compatible": "apple,t6000-isp",
        "status": "okay",
        "driver": "bound",
        "count": 1
      },
      {
        "compatible": "apple,t6000-mca",
        "status": "okay",
        "driver": "bound",
        "count": 1
      },
      {
        "compatible": "apple,t6000-nco",
        "status": "okay",
        "driver": "bound",
        "count": 1
      },
      {
        "compatible": "apple,t6000-nvme-ans2",
        "status": "okay",
        "driver": "bound",
        "count": 1
      },
      {
        "compatible": "apple,t6000-pcie",
        "status": "okay",
        "driver": "bound",
        "count": 1
      },
      {
        "compatible": "apple,t6000-pinctrl",
        "status": "okay",
        "driver": "bound",
        "count": 4
      },
      {
        "compatible": "apple,t6000-pmgr",
        "status": "okay",
        "driver": "unbound",
        "count": 3
      },
      {
        "compatible": "apple,t6000-pmgr-misc",
        "status": "okay",
        "driver": "bound",
        "count": 1
      },
      {
        "compatible": "apple,t6000-pmgr-pwrstate",
        "status": "okay",
        "driver": "bound",
        "count": 187
      },
      {
        "compatible": "apple,t6000-pmp-v2",
        "status": "disabled",
        "driver": "none",
        "count": 1
      },
      {
        "compatible": "apple,t6000-pmp-v2-report",
        "status": "okay",
        "driver": "bound",
        "count": 1
      },
      {
        "compatible": "apple,t6000-pmp-v2-report-entry",
        "status": "disabled",
        "driver": "none",
        "count": 5
      },
      {
        "compatible": "apple,t6000-pmp-v2-report-entry",
        "status": "okay",
        "driver": "bound",
        "count": 5
      },
      {
        "compatible": "apple,t6000-sart",
        "status": "okay",
        "driver": "bound",
        "count": 1
      },
      {
        "compatible": "apple,t6000-sio",
        "status": "okay",
        "driver": "bound",
        "count": 1
      },
      {
        "compatible": "apple,t6000-smc",
        "status": "okay",
        "driver": "bound",
        "count": 1
      },
      {
        "compatible": "apple,t6000-spi",
        "status": "okay",
        "driver": "bound",
        "count": 2
      },
      {
        "compatible": "apple,t6000-spmi",
        "status": "okay",
        "driver": "bound",
        "count": 1
      },
      {
        "compatible": "apple,t6000-wdt",
        "status": "okay",
        "driver": "bound",
        "count": 1
      },
      {
        "compatible": "apple,t8110-dart",
        "status": "okay",
        "driver": "bound",
        "count": 1
      },
      {
        "compatible": "arm,armv8-timer",
        "status": "okay",
        "driver": "none",
        "count": 1
      },
      {
        "compatible": "cirrus,cs42l84",
        "status": "okay",
        "driver": "bound",
        "count": 1
      },
      {
        "compatible": "fixed-clock",
        "status": "okay",
        "driver": "none",
        "count": 8
      },
      {
        "compatible": "fixed-layout",
        "status": "okay",
        "driver": "bound",
        "count": 1
      },
      {
        "compatible": "fixed-partitions",
        "status": "okay",
        "driver": "bound",
        "count": 1
      },
      {
        "compatible": "jedec,spi-nor",
        "status": "okay",
        "driver": "bound",
        "count": 1
      },
      {
        "compatible": "operating-points-v2",
        "status": "okay",
        "driver": "none",
        "count": 3
      },